template_id,post_text,category,cta_type,link_included,image_upload_recommended,recommended_styles,scheduled_at,status,quality_note
T0001,"AI 프로필 한 장 예쁘게 나오면
괜히 내일 아침부터 바꾸고 싶어짐
밤이라 그런 결심을 잘 만들지",image_recommended,none,no,yes,dreamy-wildflower|datecam-film|ulzzang-cam,2026-04-24 10:21,draft,
T0002,"멋있게 남는 결과가 좋은지
친구 반응 오는 결과가 좋은지

둘 다 포기 못 하는 사람 많을 듯
이런 거 좋아하면 맞을 듯",soft_cta,soft,no,no,,2026-04-24 17:42,draft,
T0003,"저장보다 공유가 먼저 나오는 결과는
확실히 따로 있음

내 기준엔 반응할 문장이 저절로 떠오르는 결과가 그렇더라
한 번 구경해봐도 재밌을 듯",soft_cta,soft,no,no,,2026-04-24 21:54,draft,
T0004,"나도 딱 그랬어
하나만 해보고 자야지 했다가
몇 장 더 돌리고 있었음 🌙
https://www.styledrop.cloud/",direct_cta,direct,yes,no,,2026-04-25 12:38,draft,
T0005,"권투 선수처럼 강한 톤과
눈 오는 밤처럼 조용한 톤 중에
내 얼굴이 어디서 더 살아날지 꽤 궁금하지 않나?",conversation,none,no,no,,2026-04-25 16:53,draft,
T0006,"심심할 때 시작했다가
의외로 한두 장 더 보게 되는 서비스가 있잖아

이번엔 딱 그 정도 밀도의 재미를 원했음
이런 거 좋아하면 맞을 듯",soft_cta,soft,no,no,,2026-04-25 22:14,draft,
T0007,"왠지 라면머리 느낌의 카드가 좋은 이유는
대충 어떤 느낌일지 알 것 같으면서도
막상 내 얼굴 넣으면 전혀 다를 것 같아서임
해보면 나름 신기할걸",soft_cta,soft,no,no,,2026-04-26 11:19,draft,
T0008,"퇴근길 내 사진 보다가
아 오늘 너무 무난하게 살았나 싶으면
다른 스타일로 한 번 바꿔보는 재미가 있어
한 번 구경해봐도 재밌을 듯",soft_cta,soft,no,no,,2026-04-26 17:27,draft,
T0009,"혼자만 재밌으면 금방 식는데
누가 한 번 받아주면 갑자기 서비스 체감이 확 커지더라

공유성 보는 이유가 딱 그거임?",conversation,none,no,no,,2026-04-26 22:13,draft,
T0010,"익숙한 셀카로 놀고 싶은지
완전히 새로운 캐릭터가 되고 싶은지 나만 그런가 😂
그 선을 고르는 재미가 있음

https://www.styledrop.cloud",direct_cta,direct,yes,no,,2026-04-27 10:37,draft,
T0011,"이 서비스는 결국
예쁜 셀카를 만드는 것보다
내 분위기를 꺼내는 쪽이 더 가까워",text_only,none,no,no,,2026-04-27 16:36,draft,
T0012,"아까 테스트하다가
내 얼굴이 의외로 진지한 프로필처럼 나와서
조금 당황했음
가끔 프로필 사진 바꾸고 싶어질 정도였어",image_recommended,none,no,yes,datecam-film|ulzzang-cam|idol-photocard,2026-04-27 21:01,draft,
T0013,"요즘 카드 하나가 세다는 건
결과가 좋아서가 아니라 질문을 남겨서인 것 같음

그 질문이 생기면 손이 자연스럽게 감
한 번쯤 눌러보면 웃길지도",soft_cta,soft,no,no,,2026-04-28 12:01,draft,
T0014,"예전엔 뭘 해주는지가 중요했고
지금은 어떤 기분으로 쓰게 되는지가 더 중요해졌음

가벼운 서비스일수록 특히
한 번쯤 눌러보면 웃길지도",before_after_recommended,soft,no,yes,cinematic-horseback|bronze-statue-bench|club-flash,2026-04-28 16:48,draft,
T0015,"나 혼자 만들었단 사실보다
나도 누군가가 써주고 웃었다는 사실이 더 오래 남더라
그래서 계속 다듬게 됨",text_only,none,no,no,,2026-04-28 21:28,draft,
T0016,"회사 끝나고 지친 얼굴로 찍은 사진도
의외로 분위기 있게 바뀌더라
그게 좀 위로였어
https://www.styledrop.cloud/",before_after_recommended,direct,yes,yes,club-flash|rainy-crosswalk|red-carpet-glam,2026-04-29 11:46,draft,
T0017,"사람들이 오래 머무는 이유를 보면
기능이 많아서가 아니라 예상보다 진입이 가벼워서더라

복잡한 거 싫어하는 사람일수록 잘 맞을 수 있음
이런 거 좋아하면 맞을 듯",soft_cta,soft,no,no,,2026-04-29 17:19,draft,
T0018,"예전엔 결과를 모으는 느낌이었고
지금은 장면을 넘겨보는 느낌이 더 강함

가볍게 즐기기엔 후자가 확실히 낫더라
해보면 나름 신기할걸",before_after_recommended,soft,no,yes,red-carpet-glam|cinematic-horseback|bronze-statue-bench,2026-04-29 22:01,draft,
T0019,"혼자 만든 서비스라서 그런지
새벽 가까워질수록 반응이 더 신경 쓰여
누가 조용히 해보고 갔을까 싶고
해보면 나름 신기할걸?",conversation,soft,no,no,,2026-04-30 11:38,draft,
T0020,"이건 광고라기보다
내가 만든 거 한번 봐달라는 말에 가깝다
근데 결과는 꽤 괜찮게 뽑힘 👀
https://www.styledrop.cloud/",direct_cta,direct,yes,yes,skydiving|idol-photocard|dreamy-wildflower,2026-04-30 18:36,draft,
T0021,"단톡방에서 반응 오는 카드가 있고
개인톡에서 더 웃긴 카드가 있더라

공유 맥락까지 달라지는 게 재밌었음",soft_cta,none,no,no,,2026-04-30 21:21,draft,
T0022,"짧게 구경해도 감 오는 서비스 좋아하는 사람이라면
카드형 구조가 꽤 잘 맞을 수 있음

https://www.styledrop.cloud",direct_cta,direct,yes,yes,dreamy-wildflower|red-carpet-glam|maid-cafe-heart,2026-05-01 11:02,draft,
T0023,"프로필 컷도 챙기고 싶고
장난스러운 컷도 놓치기 싫은 사람이라면
가끔 카드 여러 장 넘겨보는 재미를 크게 느낄 수 있음
한 번 구경해봐도 재밌을 듯",soft_cta,soft,no,no,,2026-05-01 17:07,draft,
T0024,"오늘 점심시간에
내가 만든 서비스 한 번만 구경해줘도 좋고
마음에 드는 컷 하나 건지면 더 좋고
나는 그걸로 꽤 오래 기분 좋을 듯
https://www.styledrop.cloud/",direct_cta,direct,yes,no,,2026-05-01 21:53,draft,
T0025,"요즘 예쁜 결과를 만드는 것과
재밌는 경험을 만드는 건 다르더라

이번엔 전자보다 후자에 더 가까운 쪽으로 밀어봤음 ㅋㅋ 😶",text_only,none,no,no,,2026-05-02 10:01,draft,
T0026,"예측 가능한 결과만 쌓이면
솔직히 아무리 안정적이어도 호기심이 빨리 줄더라

요즘 그래서 낯섦을 조금 더 남겨뒀다",before_after_recommended,none,no,yes,club-flash|rainy-crosswalk|red-carpet-glam,2026-05-02 16:57,draft,
T0027,"나만 그런지 모르겠는데
요즘 멋진 결과보다 장난스럽게 잘 나온 결과를 더 자주 다시 보게 됨

왠지 이런 취향 가진 사람은 꽤 공감할 듯
나중에 저장해두고 해봐도 좋아",soft_cta,soft,no,no,,2026-05-02 22:09,draft,
T0028,"프로필 사진 고민이 제일 심해지는 시간도 밤인 것 같아
그래서 이 시간대에 AI 프로필 반응이 좋나 봄 ✨
https://www.styledrop.cloud/",direct_cta,direct,yes,yes,red-carpet-glam|maid-cafe-heart|skydiving,2026-05-03 11:48,draft,
T0029,"혼자 개발할 때 늘 아쉬운 게
사람 반응을 바로 못 보는 건데
그래서 더 많이 써봐줬으면 싶다",text_only,none,no,no,,2026-05-03 17:26,draft,
T0030,"예전엔 결과 저장이 끝이었다면
지금은 다른 카드까지 눌러보면 성공이라 본다

그 흐름 궁금하면 https://www.styledrop.cloud",before_after_recommended,direct,yes,yes,bronze-statue-bench|club-flash|rainy-crosswalk,2026-05-03 20:52,draft,
T0031,"낮에는 재미로 눌렀다면
밤에는 조금 더 나를 들여다보게 되는 서비스
결국 그 차이 때문에 남는 것 같아",text_only,none,no,no,,2026-05-04 12:12,draft,
T0032,"퀄 좋은 한 장과
반응 오는 한 장 중 하나만 고르면
다들 어느 쪽을 고를지 궁금하다

나도 나는 요즘 후자 쪽으로 기움
해보면 나름 신기할걸",before_after_recommended,soft,no,yes,rainy-crosswalk|red-carpet-glam|cinematic-horseback,2026-05-04 18:28,draft,
T0033,"재밌는 건
잘 나온 한 장보다 친구 반응이 붙는 한 장이 더 오래 남는다는 거

그 포인트를 계속 생각하면서 만들었음",soft_cta,none,no,no,,2026-05-04 20:36,draft,
T0034,"결과물 경쟁처럼 보이는 서비스들 사이에서
장면 선택 재미를 먼저 꺼내고 싶었음

궁금하면 https://www.styledrop.cloud",direct_cta,direct,yes,yes,maid-cafe-heart|skydiving|idol-photocard,2026-05-05 12:22,draft,
T0035,"공유하기 좋은 서비스는
설명 안 붙여도 바로 반응할 포인트가 있더라

그 한 번의 반응이 꽤 크다
한 번쯤 눌러보면 웃길지도",soft_cta,soft,no,no,,2026-05-05 17:33,draft,
T0036,"나도 원래 이런 거 잘 안 믿는데
결과물 뜨는 순간
아 이건 좀 저장하고 싶다 싶더라
해보면 나름 신기할걸 뭔가 👀",soft_cta,soft,no,no,,2026-05-05 22:27,draft,
T0037,"오늘 사람 너무 많이 만나서 지쳤는데
요즘 집 가는 길에 내 얼굴로 다른 카드 몇 장 뽑아보니까
의외로 마음이 좀 풀리더라",image_recommended,none,no,yes,datecam-film|ulzzang-cam|idol-photocard,2026-05-06 10:31,draft,
T0038,"혼자 만든 거라 더 조심스러운데 은근 😆
이상하게 밤에는 솔직하게 말하게 된다
재밌으면 같이 놀아줘 봐",text_only,none,no,no,,2026-05-06 18:26,draft,
T0039,"방금 다시 테스트해봤는데 ㅋㅋ
그냥 이번엔 관상 결과가 좀 맞는 것 같아서 웃겼음
나도 너무 진지하게 보면 안 되는데 자꾸 보게 됨",image_recommended,none,no,yes,idol-photocard|red-carpet-glam|dreamy-wildflower,2026-05-06 20:47,draft,
T0040,"나도 비슷한 분위기만 반복되면 질리니까
장면 간 온도차를 크게 준 쪽으로 만들었음

https://www.styledrop.cloud",direct_cta,direct,yes,no,,2026-05-07 11:58,draft,
T0041,"내가 만든 서비스인데도
결과물 뜰 때마다 약간 남의 일처럼 재밌음
그냥 그만큼 결과가 제각각이더라",image_recommended,none,no,yes,dreamy-wildflower|datecam-film|ulzzang-cam,2026-05-07 17:51,draft,
T0042,"점심시간엔 뭔가 크게 결정 안 하잖아 진짜
그냥 가볍게 구경하는 서비스가 좋음
이건 그런 쪽이야
나중에 저장해두고 해봐도 좋아",soft_cta,soft,no,no,,2026-05-07 22:06,draft,
T0043,"눈길 가는 카드 하나만 있어도 😂
AI 사진 서비스 체감이 완전히 달라지더라

그냥 그런 장면들 모아둔 곳
https://www.styledrop.cloud",direct_cta,direct,yes,yes,red-carpet-glam|maid-cafe-heart|skydiving,2026-05-08 11:53,draft,
T0044,"요즘 혼자 만드는 서비스라 많이 부족할 수도 있지만
솔직히 그래도 재미 하나는 놓치고 싶지 않았어
그건 끝까지 붙잡았음",text_only,none,no,no,,2026-05-08 18:39,draft,
T0045,"퍼스널컬러 결과 보면서
오늘 왜 이 옷이 안 어울렸는지 깨달으면 ✨
조금 허탈하고 조금 재밌음?",conversation,none,no,no,,2026-05-08 21:24,draft,
T0046,"전에는 보정앱처럼 느껴졌다면
왠지 지금은 작은 놀이 서비스에 더 가까운 느낌임

만드는 기준도 같이 바뀌더라",before_after_recommended,none,no,yes,club-flash|rainy-crosswalk|red-carpet-glam,2026-05-09 11:54,draft,
T0047,"친구 얼굴 넣어봤을 때
진지한 콘셉트가 더 웃긴지
가벼운 콘셉트가 더 웃긴지

이거 해보면 예상보다 갈림
한 번 구경해봐도 재밌을 듯",soft_cta,soft,no,no,,2026-05-09 18:31,draft,
T0048,"카드 이름만 보고
이건 내 얼굴로 보면 이상하게 재밌겠는데 싶은 순간이 있음

그런 장면 좋아하는 사람은 저장해둘 만할 듯
이런 거 좋아하면 맞을 듯",soft_cta,soft,no,no,,2026-05-09 21:27,draft,
T0049,"2인 카드가 왜 재밌냐면
결과보다 대화가 먼저 생기기 때문이더라

그 감각 궁금하면 https://www.styledrop.cloud",conversation,direct,yes,no,,2026-05-10 11:06,draft,
T0050,"AI 오디션 결과는
매번 다른 말투로 나오는 것도 재밌음
괜히 계속 다음 결과가 궁금해짐",image_recommended,none,no,yes,red-carpet-glam|dreamy-wildflower|datecam-film,2026-05-10 17:33,draft,
T0051,"괜히 단톡방에 올리고 싶은 결과는 따로 있더라 은근

이번엔 너무 잘 만든 느낌보다
반응하기 쉬운 느낌을 더 신경 썼음
이런 방향 좋아하면 봐둬도 좋음
한 번 구경해봐도 재밌을 듯",soft_cta,soft,no,no,,2026-05-10 22:17,draft,
T0052,"그냥 지금 이 시간엔
예쁜 것보다 공감 가는 게 좋잖아
가끔 그래서 글도 서비스도 조금 덜 꾸몄어",text_only,none,no,no,,2026-05-11 12:13,draft,
T0053,"결과가 예쁜 건 기본이고
나는 요즘 그다음 이야기가 생기는지가 더 중요해졌음

다들 서비스 볼 때 이런 포인트도 보나 궁금하다
나중에 저장해두고 해봐도 좋아",soft_cta,soft,no,no,,2026-05-11 18:34,draft,
T0054,"밤에 누워서 이런 거 보면
가끔 괜히 셀카첩 뒤적이게 돼
제일 잘 나온 사진 찾으려고",image_recommended,none,no,yes,idol-photocard|red-carpet-glam|dreamy-wildflower,2026-05-11 21:26,draft,
T0055,"너라면 😶
첫 카드로 강한 콘셉트 고를지
편안한 무드 고를지

이 선택만 봐도 취향 보여서 재밌음
한 번 구경해봐도 재밌을 듯",soft_cta,soft,no,no,,2026-05-12 10:19,draft,
T0056,"점심 먹고 졸릴 때
이런 거 하나 있으면 좀 깸
내 사진이 갑자기 다른 세계관 사람이 돼버림",image_recommended,none,no,yes,dreamy-wildflower|datecam-film|ulzzang-cam,2026-05-12 17:43,draft,
T0057,"상상되는 장면보다
안 상상되는 장면이 더 오래 붙잡힐 때가 있음

결과가 머릿속에 안 그려질수록 더 궁금하니까
한 번쯤 눌러보면 웃길지도",soft_cta,soft,no,no,,2026-05-12 21:04,draft,
T0058,"예전엔 한 장 만들고 끝나는 사용성이었다면
지금은 하나 만들고 옆 카드도 눌러보는 흐름을 더 봄

이 차이가 살짝 크다",before_after_recommended,none,no,yes,red-carpet-glam|cinematic-horseback|bronze-statue-bench,2026-05-13 11:21,draft,
T0059,"AI 이미지 서비스 만들면서 제일 많이 들은 말이
솔직히 “처음엔 재밌는데 금방 질린다”였음

그 말 듣고
계속 눌러보게 되는 구조를 더 오래 붙잡게 됐음",text_only,none,no,no,,2026-05-13 17:08,draft,
T0060,"하나 잘 만드는 것보다 나만 그런가 😆
계속 보게 만드는 쪽으로 시선을 옮겼음

차이 느껴보고 싶으면 https://www.styledrop.cloud",before_after_recommended,direct,yes,yes,bronze-statue-bench|club-flash|rainy-crosswalk,2026-05-13 20:59,draft,
T0061,"내가 만든 서비스라고 해서
무조건 좋게 보진 않거든
근데 이건 진짜 내가 먼저 꽤 자주 쓰게 됐어",text_only,none,no,no,,2026-05-14 11:38,draft,
T0062,"카드 제목만 봐도
결과를 상상하게 되는 순간이 있지

그런 흐름으로 만든 장면들이 궁금하면
https://www.styledrop.cloud",direct_cta,direct,yes,yes,dreamy-wildflower|red-carpet-glam|maid-cafe-heart,2026-05-14 17:09,draft,
T0063,"사진 서비스에서도
너무 기능적인 것보다 감성 있는 쪽에 손이 가는 사람 있지

나는 확실히 그쪽이라 이런 걸 더 만들게 됨
이런 거 좋아하면 맞을 듯",soft_cta,soft,no,no,,2026-05-14 20:57,draft,
T0064,"퇴근하면서 가볍게 눌렀다가
예상보다 오래 남는 결과를 보면
이상하게 잘 만들었다는 안도감이 든다 ✨
https://www.styledrop.cloud/",direct_cta,direct,yes,yes,maid-cafe-heart|skydiving|idol-photocard,2026-05-15 10:16,draft,
T0065,"나만 아직 무드 있는 프로필 사진 없나
요즘 이 생각 들기 시작하면
결국 한 번 눌러보게 되는 듯
나중에 저장해두고 해봐도 좋아",soft_cta,soft,no,no,,2026-05-15 18:16,draft,
T0066,"퇴근 시간엔 설명 긴 거 안 보잖아
가끔 그래서 최대한 바로 이해되고
바로 결과 나오는 흐름으로 만들었어",image_recommended,none,no,yes,dreamy-wildflower|datecam-film|ulzzang-cam,2026-05-15 21:22,draft,
T0067,"가끔 비 오는 장면이 먼저인지
웃긴 콘셉트가 먼저인지
취향 테스트하듯 골라보는 재미가 있음

https://www.styledrop.cloud",direct_cta,direct,yes,no,,2026-05-16 11:24,draft,
T0068,"내 얼굴이 영화 포스터처럼 나올 줄은 몰랐는데
막상 그러고 나니까
프로필 사진도 바꾸고 싶어지더라",image_recommended,none,no,yes,ulzzang-cam|idol-photocard|red-carpet-glam,2026-05-16 18:29,draft,
T0069,"같이 사진 넣어볼 사람 한 명 떠오르면
이런 서비스는 이미 절반은 성공한 느낌임

다들 그런 사람 하나쯤 있지 않나
한 번쯤 눌러보면 웃길지도",soft_cta,soft,no,no,,2026-05-16 21:23,draft,
T0070,"AI 사진이 뻔하게 느껴졌다면
이번엔 결과보다 카드 고르는 순간을 먼저 봐도 됨

https://www.styledrop.cloud",direct_cta,direct,yes,yes,skydiving|idol-photocard|dreamy-wildflower,2026-05-17 10:52,draft,
T0071,"점심 먹다가 우연히 들어온 사람도
바로 이해할 수 있게 만들고 싶었어
솔직히 설명 길면 나도 안 읽으니까",text_only,none,no,no,,2026-05-17 18:17,draft,
T0072,"내 얼굴이 카드 한 장으로 정리되면
그냥 하루가 끝난 느낌도 같이 들어 🙂
그래서 자기 전에 보기 좋음",image_recommended,none,no,yes,datecam-film|ulzzang-cam|idol-photocard,2026-05-17 21:19,draft,
T0073,"다들 카드 볼 때
직관적으로 끌리는 것부터 누르는 편인지
의외성 큰 것부터 누르는 편인지 궁금하다 ㅋㅋ
한 번 구경해봐도 재밌을 듯",soft_cta,soft,no,no,,2026-05-18 12:29,draft,
T0074,"이 시간대엔
예쁘다보다 분위기 있다가 더 크게 들려
그래서 결과 톤도 그렇게 잡아봤어 진짜 🥹",image_recommended,none,no,yes,idol-photocard|red-carpet-glam|dreamy-wildflower,2026-05-18 18:07,draft,
T0075,"익숙한 얼굴로 낯선 장면 보는 게 재밌는 사람과
완전히 새로운 캐릭터 되는 게 좋은 사람
둘 다 꽤 선명하게 갈리더라
해보면 나름 신기할걸 뭔가",soft_cta,soft,no,no,,2026-05-18 21:31,draft,
T0076,"잘 만든 결과보다
잘 고르게 만드는 구조가 더 어렵더라 진짜 🌙

그래서 오히려 그 부분을 더 많이 만지게 됐다",before_after_recommended,none,no,yes,club-flash|rainy-crosswalk|red-carpet-glam,2026-05-19 10:01,draft,
T0077,"서비스 만드는 입장에서 제일 재미있는 순간은 뭔가
예쁘다는 반응보다 웃으면서 다시 누르는 순간임

그 반응이 나오면 방향이 맞았다는 뜻이더라",text_only,none,no,no,,2026-05-19 17:46,draft,
T0078,"솔직히 내 사진이 서부 총잡이로 뜬 거 보고
나도 이상하게 오늘 업무보다 그게 더 기억남
그 정도로 존재감은 있음",image_recommended,none,no,yes,ulzzang-cam|idol-photocard|red-carpet-glam,2026-05-19 22:06,draft,
T0079,"혼자 만드는 서비스라
별거 아닌 클릭 하나도 크게 느껴짐
근데 이건 진짜 재미로 보기 좋아서 ..
점심에 가볍게 눌러보면 될 듯
해보면 나름 신기할걸",soft_cta,soft,no,no,,2026-05-20 11:39,draft,
T0080,"보기 전부터 머릿속이 바빠지는 카드가 있다면
그건 이미 꽤 괜찮은 시작이라고 봄

그런 류 모아둔 곳은 여기
https://www.styledrop.cloud",direct_cta,direct,yes,yes,skydiving|idol-photocard|dreamy-wildflower,2026-05-20 18:17,draft,
T0081,"평소에도 선택할 때
무난함보다 포인트 있는 걸 고르는 사람은
나도 의외로 강한 콘셉트 카드를 더 잘 즐기더라
한 번 구경해봐도 재밌을 듯",soft_cta,soft,no,no,,2026-05-20 21:38,draft,
T0082,"회사에서 기 다 빨리고 나면
뭔가 대단한 위로보다
그냥 다른 무드의 나를 보는 게 더 낫더라",image_recommended,none,no,yes,datecam-film|ulzzang-cam|idol-photocard,2026-05-21 12:19,draft,
T0083,"서부 총잡이 버전은 진짜
친구들끼리 돌려보면 웃길 것 같아
근데 또 결과는 의외로 멋있음
이런 거 좋아하면 맞을 듯",soft_cta,soft,no,no,,2026-05-21 17:26,draft,
T0084,"2인 카드 좋아하는 사람들은
대체로 결과보다 상황 설정을 더 재밌어하더라

이 취향 공감하는 사람 꽤 있을 듯
나중에 저장해두고 해봐도 좋아",soft_cta,soft,no,no,,2026-05-21 21:32,draft,
T0085,"솔직히 사람 사이에 치이고 돌아가는 길에
그냥 나를 너무 현실적으로만 보게 될 때가 있잖아
나도 그때 조금 다른 창을 열어주는 느낌으로 만들었어",text_only,none,no,no,,2026-05-22 10:56,draft,
T0086,"감성 카드 결과는
밤에 보면 유독 저장 욕구가 세짐 🌙
낮보다 덜 민망해서 그런가
한 번쯤 눌러보면 웃길지도",soft_cta,soft,no,no,,2026-05-22 17:39,draft,
T0087,"새로운 AI 서비스라도
첫 화면에서 지루하면 거기서 끝이더라

그래서 들어오자마자 고를 맛이 있게 만드는 데 집중했음",text_only,none,no,no,,2026-05-22 21:32,draft,
T0088,"2인 카드 넣으면서 느낀 건
혼자 보는 재미랑 같이 보는 재미가 정말 다르다는 거였음

같이 넣는 순간 대화 소재가 바로 생김",soft_cta,none,no,no,,2026-05-23 10:07,draft,
T0089,"가볍게 구경하다가 은근 😆
하나 꽂히면 바로 해보는 스타일이면
장면형 서비스에서 체감이 빠르게 올 수 있음
한 번쯤 눌러보면 웃길지도",soft_cta,soft,no,no,,2026-05-23 18:09,draft,
T0090,"혼자 노는 서비스는 많지만
친구 하나만 끌어들여도 재미가 달라지는 서비스는 의외로 적더라

이번엔 그쪽에 신경을 많이 썼음",soft_cta,none,no,no,,2026-05-23 21:13,draft,
T0091,"서부 총잡이도 해보고
요즘 우주비행사도 해보고
결국 제일 오래 본 건 내 기본 분위기랑 비슷한 컷이더라
한 번 구경해봐도 재밌을 듯",soft_cta,soft,no,no,,2026-05-24 11:43,draft,
T0092,"사진 결과가 좋다는 말보다
“다른 것도 눌러보게 된다”는 말이 더 반갑더라

서비스를 계속 보게 만드는 건 ..
결국 호기심이더라고",text_only,none,no,no,,2026-05-24 17:12,draft,
T0093,"예쁜 결과보다
결과 나오기 전이 더 재밌는 서비스가 있더라

이런 구조 좋아하면 꽤 취향일 수 있음
이런 거 좋아하면 맞을 듯",soft_cta,soft,no,no,,2026-05-24 22:17,draft,
T0094,"사진 한 장으로 무드가 확 바뀌는 거
의외로 재밌더라 🙂
나 혼자 디자인하고 붙인 서비스인데
가볍게 한 번 눌러봐주면 진짜 고마움
https://www.styledrop.cloud/",before_after_recommended,direct,yes,yes,cinematic-horseback|bronze-statue-bench|club-flash,2026-05-25 11:59,draft,
T0095,"다들 AI 사진 볼 때
왠지 퀄 먼저 보는 편인지 장면 먼저 보는 편인지 궁금함

나는 후자가 훨씬 오래 간다고 느꼈다
이런 거 좋아하면 맞을 듯",soft_cta,soft,no,no,,2026-05-25 17:02,draft,
T0096,"내 얼굴이 감성 카드처럼 정리돼 나오는 순간
나도 이상하게 내가 조금 더 선명해 보이더라
밤이라라 그런가 싶기도 하고",image_recommended,none,no,yes,dreamy-wildflower|datecam-film|ulzzang-cam,2026-05-25 21:49,draft,
T0097,"친구랑 같이 웃는 결과가 좋은지
혼자 저장해두는 결과가 좋은지

이거에 따라 취향이 진짜 갈리는 듯
한 번 구경해봐도 재밌을 듯",soft_cta,soft,no,no,,2026-05-26 12:16,draft,
T0098,"처음엔 퀄만 좋으면 될 줄 알았는데
막상 오래 보는 건 다른 데 있더라

사람들은 완성컷보다
내 얼굴이 어디까지 바뀌는지에 더 오래 머묾?",conversation,none,no,no,,2026-05-26 16:36,draft,
T0099,"몽골 전사 같은 강한 설정이 더 궁금한지
일상적인 장면이 더 궁금한지
이것도 사람 취향 많이 타더라",soft_cta,none,no,no,,2026-05-26 22:26,draft,
T0100,"관상 테스트 같은 건
원래 안 믿는데도
밤엔 괜히 한 번 더 보게 된다
이런 거 좋아하면 맞을 듯",soft_cta,soft,no,no,,2026-05-27 12:31,draft,
T0101,"오늘 하루 별거 없었다 싶어도 나만 그런가 😶
사진 하나으로 분위기가 바뀌면
가끔 이상하게 기분이 좀 정리돼",before_after_recommended,none,no,yes,club-flash|rainy-crosswalk|red-carpet-glam,2026-05-27 16:36,draft,
T0102,"친구한테 한번 보내봐도 돼
딱 이 말 붙이기 쉬운 서비스면
일단 반은 한 것 같더라
한 번 구경해봐도 재밌을 듯",soft_cta,soft,no,no,,2026-05-27 21:52,draft,
T0103,"혼자 보기보다
그냥 친구한테 보여주고 싶은 결과가 더 강할 때가 있음

그쪽 반응 좋아하면 아마 바로 감 올 거야
https://www.styledrop.cloud",direct_cta,direct,yes,yes,red-carpet-glam|maid-cafe-heart|skydiving,2026-05-28 11:49,draft,
T0104,"하루 종일 남 일하다가
가끔 집 가는 길엔 내 얘기 좀 보고 싶잖아 ㅋㅋ 🙂
그래서 나를 다시 보게 되는 기능들을 넣었어",text_only,none,no,no,,2026-05-28 17:04,draft,
T0105,"밤에는 사람 얼굴보다
사람 무드를 더 보게 돼
그래서 결과도 그런 방향으로 만졌어 .. 👀",image_recommended,none,no,yes,red-carpet-glam|dreamy-wildflower|datecam-film,2026-05-28 21:29,draft,
T0106,"왠지 내가 보는 너 기능은
친구들이 날 어떻게 느끼는지 궁금해서 넣었는데 .. ✨
이상하게 계속 신경 쓰이게 됨?",conversation,none,no,no,,2026-05-29 10:46,draft,
T0107,"친구 셀카 넣어서 해볼 땐
멋있는 장면이 더 좋은지 웃긴 장면이 더 좋은지 궁금함

나는 의외로 후자가 반응 더 좋았음
이런 거 좋아하면 맞을 듯",soft_cta,soft,no,no,,2026-05-29 16:42,draft,
T0108,"엄청 과하게 추천하진 않을게
그냥 소소하게 들어와서 한 장면씩 넘겨보는 재미가 있다 정도

https://www.styledrop.cloud",direct_cta,direct,yes,no,,2026-05-29 21:03,draft,
