template_id,post_text,category,cta_type,link_included,image_upload_recommended,recommended_styles,scheduled_at,status,quality_note
T0436,"재미는 있는데 귀찮으면 안 하게 되고
요즘 쉬운데 뻔하면 또 금방 떠나더라

그 중간 지점을 맞추는 게 제일 어렵더라고
나중에 저장해두고 해봐도 좋아",soft_cta,soft,no,no,,2026-09-16 10:39,draft,
T0437,"나를 꾸민다기보다
나를 다른 쪽에서 비춰보는 느낌
이런 서비스가 살짝 오래 남더라",text_only,none,no,no,,2026-09-16 16:49,draft,
T0438,"AI 프로필은 솔직히 기대 안 했는데
의외로 가장 바로 쓰고 싶어진 기능이었어
프로필 사진 갈아타고 싶을 정도",image_recommended,none,no,yes,ulzzang-cam|idol-photocard|red-carpet-glam,2026-09-16 21:03,draft,
T0439,"가끔 점심시간에 잠깐 해봤다가
그냥 의외로 오래 붙잡고 있게 되는 타입
한 장으로 끝날 줄 알았는데 아니더라
나도 https://www.styledrop.cloud/",direct_cta,direct,yes,no,,2026-09-17 11:26,draft,
T0440,"결과를 보여주기보다
궁금증을 먼저 심는 카드가 훨씬 오래 남더라

그래서 앞단 설계를 더 열심히 하게 됐음
나중에 저장해두고 해봐도 좋아",soft_cta,soft,no,no,,2026-09-17 18:11,draft,
T0441,"새로운 앱을 볼 때
기능 먼저 파는지 분위기 먼저 보는지 궁금하다

나는 완전 후자라 이런 서비스가 더 재밌음 🥹
이런 거 좋아하면 맞을 듯",before_after_recommended,soft,no,yes,club-flash|rainy-crosswalk|red-carpet-glam,2026-09-17 21:53,draft,
T0442,"나를 멋있게 만드는 것보다
나도 나를 흥미롭게 만드는 게 더 어렵더라
그래서 오래 붙잡았어",text_only,none,no,no,,2026-09-18 11:24,draft,
T0443,"요즘 내 얼굴이 우주비행사처럼 나왔는데
웃기다보다 더 멀리 가고 싶은 기분이 들더라
밤에는 이런 해석도 가능함",image_recommended,none,no,yes,ulzzang-cam|idol-photocard|red-carpet-glam,2026-09-18 18:07,draft,
T0444,"나는 요즘
사진 퀄보다 반응 포인트가 있는지가 더 중요해졌음

혼자 보고 끝나는 결과보다
누가 떠오르는 결과가 더 세더라?",conversation,none,no,no,,2026-09-18 22:01,draft,
T0445,"보정 감도 위주에서
장면 체험 위주로 보는 시선이 생기니까
같은 서비스도 완전히 다르게 느껴지더라
해보면 나름 신기할걸",before_after_recommended,soft,no,yes,bronze-statue-bench|club-flash|rainy-crosswalk,2026-09-19 12:04,draft,
T0446,"밤에 누워서 남들 사진 보다 보면
왜 나만 아직 평소 셀카 같지 싶을 때가 있잖아
그 기분을 좀 건드리는 서비스야?",conversation,none,no,no,,2026-09-19 16:39,draft,
T0447,"불 끄고 누워서 보다가
갑자기 사진 한 장 올리게 되는 서비스
대충 그런 결로 만들었어 👀
https://www.styledrop.cloud/",direct_cta,direct,yes,yes,dreamy-wildflower|red-carpet-glam|maid-cafe-heart,2026-09-19 21:49,draft,
T0448,"결과물만 잘 뽑아주는 앱은 많아도
구경하는 재미까지 주는 쪽은 많지 않더라 나만 그런가

그 미묘한 차이를 계속 붙들고 만들었음",text_only,none,no,no,,2026-09-20 10:17,draft,
T0449,"하루 끝나갈 때쯤 보는 결과물은
낮보다 조금 더 솔직하게 다가오는 것 같아 뭔가
그래서 좋음",image_recommended,none,no,yes,idol-photocard|red-carpet-glam|dreamy-wildflower,2026-09-20 17:43,draft,
T0450,"다들 결과 궁금해지는 포인트가
배경인지 의상인지 표정인지 궁금하다

나는 의외로 배경이 제일 큼
한 번 구경해봐도 재밌을 듯",soft_cta,soft,no,no,,2026-09-20 20:59,draft,
T0451,"그냥 필터처럼 소비되는 건 싫어서
조금 더 이야기 생기는 결과를 만들고 싶었어
그래서 카드 느낌으로 갔음",image_recommended,none,no,yes,dreamy-wildflower|datecam-film|ulzzang-cam,2026-09-21 10:23,draft,
T0452,"퇴근하고 나면
나를 설명하는 말보다
나를 보여주는 한 장이 더 와닿더라 ✨
https://www.styledrop.cloud/",direct_cta,direct,yes,no,,2026-09-21 18:21,draft,
T0453,"사람들이 오래 머무는 포인트는
예상보다 화질이나 디테일만은 아니더라

“이 장면에 내가 들어가면 어떨까”
이 상상이 붙는 순간이 더 컸음",text_only,none,no,no,,2026-09-21 20:42,draft,
T0454,"나도 해봐야겠다
이 생각이 슬쩍 드는 정도면 충분하다고 봐
너무 세게 밀고 싶진 않았거든 🙂
https://www.styledrop.cloud/",direct_cta,direct,yes,no,,2026-09-22 11:53,draft,
T0455,"내 얼굴이 인형뽑기 기계 안에 있으면 웃길지 귀여울지
막상 돌리기 전엔 전혀 모르겠더라

그 모름이 꽤 큰 재미였음
한 번쯤 눌러보면 웃길지도",soft_cta,soft,no,no,,2026-09-22 17:12,draft,
T0456,"AI 오디션은 웃기려고 넣었는데
결과 보고 친구한테 바로 공유하게 되는 쪽이 있더라
나도 그랬고
한 번쯤 눌러보면 웃길지도",soft_cta,soft,no,no,,2026-09-22 21:58,draft,
T0457,"설명 길면 피곤한데
결과는 재밌고 싶은 사람에게는
이런 가벼운 카드형 서비스가 잘 맞는 편임
한 번 구경해봐도 재밌을 듯 .. 😶",soft_cta,soft,no,no,,2026-09-23 11:16,draft,
T0458,"친구한테 야 이거 해봐
딱 이 말 나오게 만들고 싶었어
의외로 그런 반응이 제일 반갑더라
한 번쯤 눌러보면 웃길지도",soft_cta,soft,no,no,,2026-09-23 16:37,draft,
T0459,"혼자 만들던 걸 올려두면
반응이 없는 게 제일 무서운데
그래서 더 한 번씩 눌러주면 감사함
이런 거 좋아하면 맞을 듯",soft_cta,soft,no,no,,2026-09-23 21:11,draft,
T0460,"혼자 만들고 올려두면
반응 없을까 봐 괜히 더 들여다보게 되는데
가끔 밤엔 그 마음이 배로 커진다",text_only,none,no,no,,2026-09-24 10:14,draft,
T0461,"비슷비슷한 결과에 피로한 사람한텐 나만 그런가
작은 차이보다 큰 장면 전환이 더 잘 먹히더라

그래서 아예 결이 다른 카드들을 한데 묶어봤음
한 번쯤 눌러보면 웃길지도",soft_cta,soft,no,no,,2026-09-24 18:01,draft,
T0462,"공유가 안 되는 결과는 빨리 잊히고
반응이 붙는 결과는 오래 남더라

그 차이를 보고 만들었음
https://www.styledrop.cloud",direct_cta,direct,yes,yes,dreamy-wildflower|red-carpet-glam|maid-cafe-heart,2026-09-24 21:17,draft,
T0463,"좋은 결과는 남지만
좋은 경험은 다시 오게 하더라

그래서 이번엔 결과보다 경험 쪽을 더 많이 다듬었음
한 번쯤 눌러보면 웃길지도",soft_cta,soft,no,no,,2026-09-25 10:37,draft,
T0464,"지금 보면 아마
나도 하나쯤 만들어둘까 싶어질 수도 있음
그게 너무 과하지 않게 오면 좋겠어서 이렇게 만들었어
https://www.styledrop.cloud/",direct_cta,direct,yes,no,,2026-09-25 17:32,draft,
T0465,"AI 프로필은 낮보다 밤에 더 강한 것 같아
프로필 사진 바꾸고 싶은 충동이 이 시간에 제일 세짐",image_recommended,none,no,yes,red-carpet-glam|dreamy-wildflower|datecam-film,2026-09-25 21:37,draft,
T0466,"혼자 보기에 끝나는 서비스는 금방 식고
공유 한번 붙는 순간 체감이 확 달라짐

그쪽 흐름 신경 쓴 건 여기서 볼 수 있음
https://www.styledrop.cloud",direct_cta,direct,yes,no,,2026-09-26 12:24,draft,
T0467,"가끔 예전엔 기술 데모처럼 보였다면
지금은 친구랑 같이 노는 콘텐츠처럼 보이게 만들고 싶었음 진짜 😉

같은 AI라도 체감은 완전히 다르더라
나중에 저장해두고 해봐도 좋아",before_after_recommended,soft,no,yes,rainy-crosswalk|red-carpet-glam|cinematic-horseback,2026-09-26 17:16,draft,
T0468,"AI 사진 서비스가 다 비슷하게 느껴지는 건
사실 결과보다 과정이 뻔해서일 수도 있음

고르는 순간부터 재미가 붙어야 오래 가더라",text_only,none,no,no,,2026-09-26 20:51,draft,
T0469,"결과를 저장하는 편인지
친구 보내는 편인지에 따라 보는 포인트가 달라지더라

다들 어느 쪽이 더 큰지 궁금함
나중에 저장해두고 해봐도 좋아",before_after_recommended,soft,no,yes,cinematic-horseback|bronze-statue-bench|club-flash,2026-09-27 10:44,draft,
T0470,"퇴근 시간엔 친구한테
이거 해봐 한 마디 보내고 싶은 서비스가 좋잖아
그 느낌을 만들고 싶었어
해보면 나름 신기할걸",soft_cta,soft,no,no,,2026-09-27 18:07,draft,
T0471,"프로필용으로 보는 시선과
공유용으로 보는 시선은 정말 다르더라

이번엔 두 시선을 같이 놓고 설계했음",before_after_recommended,none,no,yes,club-flash|rainy-crosswalk|red-carpet-glam,2026-09-27 21:49,draft,
T0472,"왠지 혼자 디자인하고 개발한 거라
나도 기능 하나하나에 이유가 있는데
결국 다 나를 다시 보게 한다는 쪽으로 이어지더라",text_only,none,no,no,,2026-09-28 11:01,draft,
T0473,"사진 한 장 넣으면
내 분위기를 다른 캐릭터처럼 꺼내주는 느낌
혼자 해보다가 예상보다 잘 나와서 만족했음
https://www.styledrop.cloud/",direct_cta,direct,yes,yes,red-carpet-glam|maid-cafe-heart|skydiving,2026-09-28 18:37,draft,
T0474,"오늘처럼 피곤한 날은
관상 테스트 같은 것도 괜히 더 재밌어
진지하지 않아서 오히려 좋고",text_only,none,no,no,,2026-09-28 22:26,draft,
T0475,"밤엔 사소한 말도 오래 남고
사소한 이미지도 자꾸 생각나잖아
그래서 결과물의 여운을 많이 신경 썼어",image_recommended,none,no,yes,red-carpet-glam|dreamy-wildflower|datecam-film,2026-09-29 12:29,draft,
T0476,"나도 이런 서비스는
혼자 보기 좋은 카드와 친구 보내기 좋은 카드가 완전히 다르더라

둘 다 챙기려고 톤을 꽤 나눠봤음",soft_cta,none,no,no,,2026-09-29 17:06,draft,
T0477,"무드파인지 반응파인지
어느 쪽에 가까운지 스스로 테스트해보고 싶다면

https://www.styledrop.cloud",direct_cta,direct,yes,yes,dreamy-wildflower|red-carpet-glam|maid-cafe-heart,2026-09-29 20:59,draft,
T0478,"이거 그냥 필터 아니고
묘하게 저장하고 싶은 한 장이 남더라
그래서 점심에 몇 번씩 눌러보게 됨
한 번 구경해봐도 재밌을 듯",soft_cta,soft,no,no,,2026-09-30 11:58,draft,
T0479,"멋있는 결과를 친구한테 보내는 편인지
웃긴 결과를 더 잘 보내는 편인지

이거 꽤 사람 성향 보이더라",soft_cta,none,no,no,,2026-09-30 18:27,draft,
T0480,"나도 원래 이런 말 잘 못 하는데
혼자 만든 서비스라 더 애착이 감
그래서 가볍게라도 써줘 보면 진짜 고마워 진짜
이런 거 좋아하면 맞을 듯",soft_cta,soft,no,no,,2026-09-30 21:02,draft,
T0481,"혼자 만드는 입장이라
나도 처음 쓰는 사람 반응이 제일 귀함
근데 일단 재미는 꽤 챙겨놨다고 생각해",text_only,none,no,no,,2026-10-01 10:02,draft,
T0482,"멋있게 남는 컷이 좋은지
반응 오기 쉬운 컷이 좋은지
둘 다 포기 못 하는 사람 많지 않나
한 번 구경해봐도 재밌을 듯",soft_cta,soft,no,no,,2026-10-01 18:29,draft,
T0483,"멋있는 세계관도 좋지만
생활감 있는 배경에 내 얼굴 넣는 재미도 꽤 큼

어느 쪽이 더 궁금한지 사람마다 많이 다르더라
한 번쯤 눌러보면 웃길지도",soft_cta,soft,no,no,,2026-10-01 21:06,draft,
T0484,"솔직히 혼자 돌려보는 재미도 있지만
나는 누가 반응해줄 때 이 서비스가 더 살아난다고 느꼈음

그래서 공유 흐름도 가볍게 만들었다
나중에 저장해두고 해봐도 좋아?",conversation,soft,no,no,,2026-10-02 12:19,draft,
T0485,"재밌는 거 발견하면
혼자 저장하기보다 한 명한테 바로 보내는 사람이라면
공유성 있는 카드에 더 끌릴 가능성이 큼",image_recommended,none,no,yes,red-carpet-glam|dreamy-wildflower|datecam-film,2026-10-02 16:48,draft,
T0486,"처음엔 잘 나온 한 장이 목표였는데
지금은 다시 들어오게 만드는 게 더 중요해졌음

그 차이를 담아둔 쪽이 여기임
https://www.styledrop.cloud",direct_cta,direct,yes,no,,2026-10-02 21:26,draft,
T0487,"사실 제일 듣고 싶은 말은 그거야
가끔 어 이거 의외로 재밌네
그 한마디가 혼자 만드는 사람한텐 엄청 크더라",text_only,none,no,no,,2026-10-03 11:28,draft,
T0488,"예전엔 AI 사진을
보정 툴처럼만 생각했는데

만들다 보니
이건 가볍게 노는 콘텐츠에 더 가깝다는 걸 알겠더라",text_only,none,no,no,,2026-10-03 17:46,draft,
T0489,"결과 퀄보다 취향 맞는 장면이 중요한 사람이라면
카드만 훑어봐도 바로 감이 올 수 있음 ..

https://www.styledrop.cloud",direct_cta,direct,yes,yes,maid-cafe-heart|skydiving|idol-photocard,2026-10-03 21:51,draft,
T0490,"한 번 해보고 끝나는 서비스는
기억엔 남아도 습관은 안 되더라

이번엔 적어도 옆 카드 하나는 더 궁금해지게 만드는 걸 노렸음
이런 거 좋아하면 맞을 듯",soft_cta,soft,no,no,,2026-10-04 11:48,draft,
T0491,"전엔 한 장 뽑고 끝나는 느낌이었고
지금은 옆 카드까지 이어지는 느낌이 목표임

심심풀이 서비스일수록 이게 중요하더라
나중에 저장해두고 해봐도 좋아",before_after_recommended,soft,no,yes,club-flash|rainy-crosswalk|red-carpet-glam,2026-10-04 17:34,draft,
T0492,"퇴근길의 감정은 묘해
피곤한데 그냥 끝내긴 아쉽고
그 틈에 이런 게 조금 스며드는 것 같아",text_only,none,no,no,,2026-10-04 21:28,draft,
T0493,"혼자 작업하다가 올린 서비스인데
유독 밤에 더 잘 어울리는 결과들이 있음
조용히 보기 좋게 남아",image_recommended,none,no,yes,ulzzang-cam|idol-photocard|red-carpet-glam,2026-10-05 11:17,draft,
T0494,"오늘 하루 아무것도 안 했는데
이거 하나 해보면 괜히 뭔가 한 느낌이 남음
밤엔 그런 소소한 게 중요하더라
한 번쯤 눌러보면 웃길지도",soft_cta,soft,no,no,,2026-10-05 18:08,draft,
T0495,"내가 직접 만든 화면이라
모서리 하나 색감 하나도 다 기억하는데
거기에 결과가 딱 얹히는 순간이 좋더라",image_recommended,none,no,yes,red-carpet-glam|dreamy-wildflower|datecam-film,2026-10-05 22:19,draft,
T0496,"사람들이 내 얼굴을 어떻게 읽는지
살짝 궁금한 날이 있잖아
특히 퇴근길엔 그런 생각이 더 많아짐?",conversation,none,no,no,,2026-10-06 12:03,draft,
T0497,"요즘 사진 찍는 건 민망한데
결과 보는 건 또 좋아하는 사람 살짝 많더라

앨범 사진으로도 노는 구조가 이런 타입에 잘 맞음",image_recommended,none,no,yes,datecam-film|ulzzang-cam|idol-photocard,2026-10-06 16:57,draft,
T0498,"필터처럼 소비되는 결과는 금방 잊히는데
그냥 장면 자체가 재밌으면 다시 생각나더라

그래서 결과보다 설정을 더 오래 붙들고 만들었음
나중에 저장해두고 해봐도 좋아",soft_cta,soft,no,no,,2026-10-06 21:18,draft,
T0499,"점심 먹고 아무 생각 없을 때
이런 서비스가 제일 잘 먹히는 것 같아
설명 안 길고 바로 결과 나오는 거",image_recommended,none,no,yes,idol-photocard|red-carpet-glam|dreamy-wildflower,2026-10-07 12:26,draft,
T0500,"가끔 잘 만든 서비스보다
괜히 한 번 더 들어가 보는 서비스가 더 어렵더라

그래서 순간 재미가 끊기지 않게 많이 만졌음
그냥 이런 포인트 좋아하면 기억해둬도 좋음 ..
해보면 나름 신기할걸",soft_cta,soft,no,no,,2026-10-07 18:01,draft,
T0501,"AI 오디션 결과가 괜히 오래 남는 이유
밤엔 사소한 평가도 마음에 걸리니까
그냥 근데 그래서 더 재밌기도 하고 👀",image_recommended,none,no,yes,dreamy-wildflower|datecam-film|ulzzang-cam,2026-10-07 21:43,draft,
T0502,"친구 사진으로도 해봤는데
왠지 장난치려다 결과가 잘 나와서
왠지 오히려 서로 저장함
이런 거 좋아하면 맞을 듯",soft_cta,soft,no,no,,2026-10-08 11:41,draft,
T0503,"가끔 서비스가 오래 보이려면
설명보다 체감이 먼저 와야 하더라

그래서 카드 제목만 봐도 상상되게 하는 데 시간을 많이 썼음
해보면 나름 신기할걸",soft_cta,soft,no,no,,2026-10-08 16:32,draft,
T0504,"가끔은 결과 퀄보다
누가 먼저 떠오르는지가 더 중요할 때가 있더라

그런 결과 좋아하면 한 번 봐도 재밌을 듯
https://www.styledrop.cloud",conversation,direct,yes,no,,2026-10-08 21:42,draft,
T0505,"다들 결과 보고 감탄하는 편인지
고르기 전에 더 설레는 편인지 궁금하다

나는 확실히 두 번째 쪽
한 번 구경해봐도 재밌을 듯",before_after_recommended,soft,no,yes,bronze-statue-bench|club-flash|rainy-crosswalk,2026-10-09 10:12,draft,
T0506,"우주 쪽이 더 어울릴지
서부 무드가 더 어울릴지
막상 보기 전엔 전혀 감이 안 잡힘

가끔 그게 오히려 재밌음",soft_cta,none,no,no,,2026-10-09 18:37,draft,
T0507,"오늘 회사에서 말 너무 많이 해서 지쳤는데
결과물 보고 혼자 조용히 웃은 순간이 있었다
그런 힘이 있는 서비스면 좋겠다고 생각했어",image_recommended,none,no,yes,datecam-film|ulzzang-cam|idol-photocard,2026-10-09 22:16,draft,
T0508,"AI 프로필 기능 넣은 이유도 비슷해
남들 보여주기보다
내가 나를 새롭게 보는 쪽이 더 컸어
이런 거 좋아하면 맞을 듯",soft_cta,soft,no,no,,2026-10-10 11:13,draft,
T0509,"요즘 AI 사진이 다 비슷하게 느껴질 때는
그냥 결과보다 장면을 먼저 보면 감이 달라짐

내가 요즘 밀고 있는 방향이 딱 그쪽임
https://www.styledrop.cloud",direct_cta,direct,yes,yes,maid-cafe-heart|skydiving|idol-photocard,2026-10-10 17:28,draft,
T0510,"퇴근길 이런 거 하나쯤 있으면 좋더라
복잡하지 않고
기분만 살짝 바꿔주는 거",text_only,none,no,no,,2026-10-10 21:47,draft,
T0511,"혼자 만들어서 더 그런지
반응 하나에도 하루 기분이 크게 왔다 갔다 해
좋은 쪽으로 흔들리면 좋겠다 싶고",text_only,none,no,no,,2026-10-11 10:56,draft,
T0512,"사람들이 날 어떻게 보는지 묻기 어려울 때
익명으로 슬쩍 확인하는 방식이 더 편하더라
가끔 그걸 그냥 기능으로 만든 거야?",conversation,none,no,no,,2026-10-11 17:18,draft,
T0513,"비 오는 횡단보도 vs 서부 총잡이
둘 중 하나만 먼저 눌러야 한다면 나만 그런가 🌙
어느 쪽이 더 궁금한지 살짝 궁금함
한 번 구경해봐도 재밌을 듯",soft_cta,soft,no,no,,2026-10-11 21:49,draft,
T0514,"비슷한 톤만 모아두면
예쁘긴 해도 기억에는 잘 안 남더라

결이 다른 카드들을 섞어놓으니 체감이 달라짐",before_after_recommended,none,no,yes,cinematic-horseback|bronze-statue-bench|club-flash,2026-10-12 11:04,draft,
T0515,"혼자 만드는 입장에선
누가 들어와서 한 장만 올려줘도
되게 큰 응원이 된다 🙂
https://www.styledrop.cloud/ 뭔가 😆",conversation,direct,yes,no,,2026-10-12 16:54,draft,
T0516,"무난함보다 포인트 있는 걸 고르는 사람은
아마 강한 카드부터 손이 갈 가능성이 큼

궁금하면 https://www.styledrop.cloud",direct_cta,direct,yes,yes,idol-photocard|dreamy-wildflower|red-carpet-glam,2026-10-12 21:52,draft,
T0517,"이건 후기라기보다 고백인데
내 사진으로 돌려보고
제일 많이 놀란 사람이 바로 나였음
나중에 저장해두고 해봐도 좋아",soft_cta,soft,no,no,,2026-10-13 11:19,draft,
T0518,"결과 하나 뽑고 끝내는 것보다
옆 카드 하나 더 눌러보게 되면 이미 충분하다고 봄

https://www.styledrop.cloud",direct_cta,direct,yes,yes,red-carpet-glam|maid-cafe-heart|skydiving,2026-10-13 18:22,draft,
T0519,"솔직히 점심시간에 보기 좋은 이유는
별생각 없이 눌렀다가
어 이거 뭐야 하고 한 번 더 보게 된다는 거
한 번쯤 눌러보면 웃길지도",soft_cta,soft,no,no,,2026-10-13 20:34,draft,
T0520,"서비스를 만들기 전엔
가끔 얼굴이 얼마나 예쁘게 바뀌는지가 핵심이라 생각했음

막상 만들고 보니
사람들은 장면에 더 반응하더라",before_after_recommended,none,no,yes,bronze-statue-bench|club-flash|rainy-crosswalk,2026-10-14 12:28,draft,
T0521,"다들 자기만의 분위기 한 장씩은 갖고 있는 것 같은데
나는 왜 아직 평범한 셀카뿐이지 싶어서 만들었어
그리고 나부터 바로 써봄?",conversation,none,no,no,,2026-10-14 18:03,draft,
T0522,"낮엔 그냥 재밌었는데
퇴근하고 다시 보니까 결과가 다르게 읽히더라
밤이라 되기 전 감성이 살짝 올라오는 시간이라 그런가",image_recommended,none,no,yes,datecam-film|ulzzang-cam|idol-photocard,2026-10-14 22:03,draft,
T0523,"같은 셀카라도
도시 밤거리랑 눈 오는 골목에 넣으면
느낌이 얼마나 달라질지 보는 맛이 있음",soft_cta,none,no,no,,2026-10-15 10:33,draft,
T0524,"밤에는 자꾸
내 얼굴이 아니라 내 분위기를 보게 돼
이 서비스가 그 포인트를 잘 건드리는 듯",image_recommended,none,no,yes,idol-photocard|red-carpet-glam|dreamy-wildflower,2026-10-15 16:53,draft,
T0525,"전엔 AI 사진을
한 번 생성하고 저장하는 걸로 끝냈다면

지금은 하나 만들고
옆 카드까지 자연스럽게 보게 되는 흐름을 더 신경 씀",text_only,none,no,no,,2026-10-15 22:26,draft,
T0526,"요즘 내 얼굴로 다른 장면을 가볍게 체험해보고 싶다면
복잡한 설명 없이 카드부터 보면 됨

왠지 https://www.styledrop.cloud",direct_cta,direct,yes,yes,idol-photocard|dreamy-wildflower|red-carpet-glam,2026-10-16 11:23,draft,
T0527,"몽골 전사 버전이 의외로 잘 나와서
원래 넣을까 말까 했던 스타일인데
결국 남겨두길 잘한 듯",text_only,none,no,no,,2026-10-16 18:16,draft,
T0528,"내 얼굴이 영화 같은 장면에 들어가면
멋있을지 어색할지부터 궁금해짐

이런 반응이 바로 나오는 카드들이 의외로 많음
한 번 구경해봐도 재밌을 듯",soft_cta,soft,no,no,,2026-10-16 20:52,draft,
T0529,"하루 종일 기능 붙잡고 있다가 나만 그런가 😂
퇴근할 때쯤 되면 늘 드는 생각
이거 누가 재밌어해주면 좋겠다?",conversation,none,no,no,,2026-10-17 10:51,draft,
T0530,"예전엔 퀄이 전부라고 생각했는데
요즘은 반응성이 더 중요하다고 느낀다

좋아요보다 한마디 나오는 결과가 더 세더라
한 번 구경해봐도 재밌을 듯",before_after_recommended,soft,no,yes,bronze-statue-bench|club-flash|rainy-crosswalk,2026-10-17 17:03,draft,
T0531,"혼자 만들다 보니까
누가 와서 한 번 눌러준다는 게
가끔 의외로 엄청 크게 느껴진다
이런 거 좋아하면 맞을 듯?",conversation,soft,no,no,,2026-10-17 21:39,draft,
T0532,"가끔 내가 보는 나 말고
남이 느끼는 나까지 궁금해지는 시간
대체로 밤이라고 뭔가
그래서 이 기능이 더 잘 맞아",text_only,none,no,no,,2026-10-18 11:33,draft,
T0533,"내 얼굴이 비 오는 횡단보도 안에 들어가면
어떤 무드가 나올지 상상해본 적 있나

이런 질문 하나가 의외로 오래 남더라",soft_cta,none,no,no,,2026-10-18 18:38,draft,
T0534,"예측 가능한 장면은 편하지만
한 번 보고 끝나는 경우가 많았음

솔직히 그래서 조금은 낯설고 조금은 익숙한 선을 계속 만졌다",soft_cta,none,no,no,,2026-10-18 22:26,draft,
T0535,"디자인도 개발도 혼자 하다 보니까 은근 ✨
사람들이 어떤 표정으로 이걸 눌러볼지
퇴근 시간쯤 되면 더 궁금해져
이런 거 좋아하면 맞을 듯",soft_cta,soft,no,no,,2026-10-19 11:09,draft,
T0536,"첫 화면에서 이미
“오늘은 이거 해볼까”가 떠오르면 훨씬 강하더라

카드형 구조의 장점이 딱 그거인 듯
한 번쯤 눌러보면 웃길지도",soft_cta,soft,no,no,,2026-10-19 17:12,draft,
T0537,"점심에 잠깐 와서
한 번 해보고 그냥 넘어가도 괜찮은데 은근 🙂
아마 한 번 더 돌리게 될 걸
나중에 저장해두고 해봐도 좋아",soft_cta,soft,no,no,,2026-10-19 21:02,draft,
T0538,"왠지 친구랑 같이 보기 좋은 카드도 있고
혼자 조용히 보는 카드도 있어서
가볍게 구경만 해도 재밌을 수 있음

https://www.styledrop.cloud",direct_cta,direct,yes,yes,red-carpet-glam|maid-cafe-heart|skydiving,2026-10-20 12:03,draft,
T0539,"내가 보는 나와
나도 남이 읽는 내 인상 사이의 차이
이 시간엔 그게 유독 더 크게 느껴짐",text_only,none,no,no,,2026-10-20 17:56,draft,
T0540,"예쁜 결과 하나보다
다음 카드가 궁금한 서비스가 더 오래 남더라

그래서 그 흐름에 집중해서 만들었음
궁금하면 https://www.styledrop.cloud",direct_cta,direct,yes,yes,skydiving|idol-photocard|dreamy-wildflower,2026-10-20 22:12,draft,
T0541,"친구랑 같이 해보면 좋은 이유
서로 놀리기 시작했다가
나중엔 각자 제일 잘 나온 컷 저장하게 됨
해보면 나름 신기할걸",soft_cta,soft,no,no,,2026-10-21 10:29,draft,
T0542,"대단한 거 하자는 느낌보다
짧게 들어와서 몇 장면 구경하는 느낌으로 보면 편함 ..

https://www.styledrop.cloud",direct_cta,direct,yes,no,,2026-10-21 18:29,draft,
T0543,"분명 내 사진인데
결과물은 약간 영화 포스터 같아서
좀 신기했어
내가 만든 건데도 계속 다시 보게 됨",image_recommended,none,no,yes,ulzzang-cam|idol-photocard|red-carpet-glam,2026-10-21 20:39,draft,
T0544,"요즘 요즘은 기능 많은 서비스보다
들어가자마자 감 오는 서비스가 더 세더라

설명 읽기 전에
손 먼저 가는 카드들을 만들고 싶었음",text_only,none,no,no,,2026-10-22 10:36,draft,
